,0
0,bronze age mindset an exhortation by bronze age pervert this book dedicated to the memory of dean dejana a spiritual brother a sardinian giant of high vision man of superhuman physical strength
1,you were too strong for this world friend
2,be reborn in a better timewe meet again we fight together
3,cover illustration by owen cyclops westernidentity victory to the gods
4,prologue this is not book of philosophy
5,it is exhortation
6,i hardly have anything to say to most who aren’t like me still less do i care about convincing
7,this is account of my reveries
8,i tried to put as brief and simple as i could the thought that motivates me and the problem faced by life in ascent and decline
9,i was convinced to write this book by certain frogs who told me “is it not a shame that hucksters are multiplying lies and jizzing their filthy doctrines into receptive minds everywhere
10,perversions lame onesare born by the thousands and haunt like myriad cripplette midgets in halls of mirrors they haunt the world books the internet
11,minds are lost
12,if you wait any longer everything will be pounded to garbage there will be nothing leftit will all turn the whole world will turn to a bulgarian rest stop lavatory
13,but have you seen the movie midnight express andand how did it make you feel” i was roused from my slumber by my frog friends and i declare to you with great boldness that i am here to save you from a great ugliness
14,if you look around eyes of some people you see a kind of demented energy
15,it’s pure anger or lust for power with nothing more
16,i hate to dirty these pages with mention of names of nobodies in our time
17,but if you see photo of hillary clintong or adam schiff with his eyes bugged out on stims and antidepressants or who knows what you know what i mean
18,there is a crease around the eye that tells it it looks like cyborg gone offscript these people have an inhuman gaze and are vehicles for something else
19,you see this also in the chiefs of the eu bureaucracy with tiny moleman eyes behind small glasses and the tiny lenses that reflect light
20,you see it in the dead robot eyes of the new hueman automatons running government departments the dmv the brutal zombies running the security in airports or hospital “health care” rooms under vicious yellow fluorescent lights
21,i wanted to expose the grim shadow of a movement that is hidden behind events of our time and from before
22,this is a great power that acts like a ghost
23,it hides in its own darkness and it has been absorbed by the lands and the peoples so that you can’t really see it anymore
24,there is just an eldritch quality embedded in things and on some faces
25,the same was said of hades
26,some said he would feel a great shame when some other god drew back the veil on the underworld so all the vile things that are there could be seen
27,is this hades of our time capable of shame
28,i heard also of such things being under the sea the disgusting and frightful things revealed when the sea recedes before a great storm
29,i will draw back the curtain on this iron prison and show you where it is you really live the secret things show in dreams
30,heraclitus say “all the things you see awake are death all the things you see asleep are sleep” he was trying to be coy
31,in his day many gods clovefooted satyr and other things showed themselves to men in dreams
32,spiritually your insides are all wet and there’s a huge hole through where monstrous powers are fucking your brain letting loose all your life and power of focus
33,you don’t see yourself as you really are but maybe some nightmare can show it to you
34,i am here to show you the way out
35,there was empedocles a philosopher man of high vision
36,he jumped into volcano aetna in sicily because he knew he would be reborn as a god
37,now imagine yourself in front of rim of aetna
38,it’s dry and sandy
39,you feel the heat but is not like you thought it might be
40,is not romantic
41,is just hot dry you can’t breathe and the smell of infernal sulfur and wet earth and even worse things triggers an old memory or instinct in you to run
42,you’re brought to face with a vehemence and brutality of rock and you start to feel dizzy staring in
43,molten rock in your nostrils and it’s not just that it scares you
44,if it were great fear that could be a spur to action
45,but it fills your nostrils with banality and dullness of plain molten dust you see gray and black
46,it reminds you of torrid summer afternoon by abandoned gas station you are stranded on dirt road choked by heat and so much dust
47,you see flames in the hole but it lacks the romance of fire as you imagined it
48,is this it
49,it seems like nothing to you because to your eye it’s nothing
50,so you pull away from it
51,you’re not reborn as a god you remain a mule
52,your lying mind now comes up with many thoughts about why it’s right to pull back
53,why of course
54,there’s a nice meal to have a glass of wine
55,maybe there’s a girl waiting
56,her pussy is warm and inviting
57,empedocles was deluded
58,no don’t jump in aetna or mauna loa or puyehue or eyjafjallajökull titans of the world even if you get yourself to do it it won’t work now
59,these portals are closed for ages
60,but
61,other doors are closed to you too
62,what mount aetna was to empedoclesis there something like that to you
63,is there something like that at all anymore
64,life has a thing inside it that reaches beyond itself
65,this is intergalactic worm i can’t say here you must wait
66,but if you don’t reach beyond yourself you are dead
67,most of mankind is the walking dead
68,i tell you other story
69,in stone age man appears very strong shoulders with club in hand
70,he is believed by the people to be a son of some godof a mortal woman who cucked her husband with a god
71,as child he already displays superhuman strength
72,when he grows he goes into the deepest wild to fight great cave lion
73,he emerges from cave with skin of lion on his back
74,lion had been eating and working terror in the people but now he wears this terror on his shoulders
75,he carries lion mane on head lion pelt on back and a great club in the hand
76,this man comes to be worshiped by the people his progeny become lines of kings of sparta and many other places
77,what was his act of foundation
78,he slaughtered monsters he made the seaways known to man and tamed the rock face
79,but don’t forget the lionskin on his shoulders
80,this was lion of nemea
81,do you understand what nemesis is
82,there is in nature a great purgative function
83,you know about monkeys who switch sex in certain times
84,in lake of some reptiles when they overpopulate it and there is a surplus of refuse there is trigger in nature a monster is born to them
85,a lizard many times the size of a normal one is born who deals out destruction and culls the lake
86,the greeks believed in this great power and worshiped its justice
87,in bible it appears as allegory of the flood which in fact refers to the irrepressible spirit of the sea peoples and the divine justice they brought to cities whose life had grown pointless and a great ugliness on the world
88,you bring lion cub into the house but aeschylus say it will become a priest of doom when it reaches age in nature there is irrepressible force
89,its violence against the surfeit of populations is divine justice
90,its destruction of the feeble designs of reason the pointless words of manthis is beautiful
91,this what the power of nemesis means few are chosen to wield it fewer realize they are chosen or know what to do with it
92,when hercules puts on the power of nemesis on his shoulders he becomes hero who makes the world tame and safe for cities of real men
93,but that was in his time and ours is an age of surfeit
94,it is different function
95,the star of nemesis is sure to return and it must already be burning inside some of you
96,in the bronze age men had life and force and i already see far on the horizon of our world but the glimmer is surely theremay it not be a mirage i see this spirit returning surely in our time
97,piratical bands and brotherhoods will take to the seas and not just to the seas
98,the enemies of western man and the enemies of beauty are to learn just what was meant by a piratical race a nest of pirates like the chinese thought of the dutch on first meeting them
99,i want to prepare you to receive this old spiritold spirits are moving from behind the reeds the silhouette shimmers against a river in late summer and i see already men who know how to honor such uncanny old friends
100,may they inhabit us again and give us strength to purify this world of refuse
101,part one the flame of life 1 what if you’ve been misled about what is life
102,they do this by showing you two red marionette and shake them in front then you stay mesmerized and clap like trained seal
103,is like in politics before last year
104,you had in years before trump the fat bald gluttons of the right put in a fighting ring against the janet renos the womyn with pickup trucks the thinlipped transnumales of the left
105,you had good people mesmerized even by this show and it’s funny to see a fat bald man try to tear out the eyes of woman of strong forearm with mullet both frothing at mouth
106,both saying nothing but grunts of pigs and premade platitude formula
107,but meanwhile the nation suffered and the future of youth was given away
108,when they trick you about what is life this even worse because you don’t see problem right away but then comes out sixty years later and your grandchildren don’t exist or they are 56 humanoid shifting about between shadows or they are of noble power but have to hide under half finished buildings because are hunted
109,but you must understand both left and right have been fooled about what is life
110,2 group of horses in broad plain and the lead stallion is captured by a wild spirit starts to gallop this way and that and the whole herd follows in a great rush of power and freedomnietzsche talks about this
111,i’ve seen many things like this myself was at big waterfall gathering place of many birds and other animal
112,through all the cycles of history this place remains and birds who witnessed the coming and going of human civilizations remember it through the aeons and always return there
113,i saw many group of small birds when the weather slightly changed this waterfall so big that a small wind would make spray of water everywhere
114,sun came from behind clouds and spread many small rainbows birds would become excited come out from crevasses in rock face and would glory in the sprays of water and the rainbows they swoon doing acrobatics this way and that
115,like when homer says that on some asian meadow tribes of geese and crane and longnecked swans glory in the power of their wings above it then land between the rivers in skamandrian plain with a great clang
116,is not enough just to say what is purpose of this to survival or reproduction
117,surely some pedant can make a story
118,but when you see this behavior is not so alien
119,maybe in happiest moments you were free to act and feel the same what anything to do with survival or reproduction
120,that kind of heavy necessity is the spirit of gravity and this is opposite
121,that petty and cramped view of lifebut in truth life as it is when free life in abundance knows luxury surfeit and wastesurvival and reproduction are side effects of something else 3 the most noble animals refuse to breed in captivity
122,many animal not just man choose death when trapped
123,but i thought all life strove for mere survival and reproduction but this not enough
124,but if not enough then must understand animal in some other way
125,very much when thinkers talk about “evolutionary psychology” they abstract from way of yeast to way of animals and man but this is backward
126,4 there’s a sociology of the world of scientists like of everything else
127,this is a cause of much confusion about biology and ideas of evolution
128,you think you’ve been given objective truth but the minds of biologists are in general very limited
129,the truth is the biggest minds always went for physics among the sciences then maybe chemistry
130,until recently but even now biology gives little opportunity for the kind of thinking that penetrates mystery of nature the kind of insight into physical relations that attracts the best scientific minds
131,they’ve been on the whole a halfandhalf group in history
132,schopenhauer refers with contempt to the people who have their “catalogues of monkeys” and think they understand nature
133,darwin himself nietzsche called him a petty mind the kind of calculator who likes to collect many small facts and synthesize some clumsy theory
134,the theory is clumsy and full of holes
135,this is the biggest reason creationists who are also wrong have been able to challenge it where they were never able to challenge theoretical physics
136,there is much dishonesty and stupidity among scientists and biologists when they talk about evolution and life
137,5 the problem now is you think i want to attaq idea of evolution or to change it because it’s racist or uncomfortable just like the left and others attaq or suppress it
138,this is not true
139,listen you don’t need darwin to believe in heredity and even evolution
140,people knew about heredity and the different lineages of man long before darwin
141,in the political sense the promotion of darwin teaching and its application to mankind is a great good
142,the left and its many robotsi will talk of their origin laterwant nothing more than to hide truth about human nature
143,and darwin evolutionary science in all its forms is a great weapon of truth against them
144,in all this i agree but remember the marionettes i mentioned
145,don’t be distracted by the puppet play
146,it is important not to be misled by a fierce debate with a stupid opponent into just accepting the only other alternative that is presented to you
147,although the left or what i have termed the bugman hates and fears evolutionary ideas applied to humans darwinism itself is the product of bugthought
148,in the end it won’t show you way out of the prison of the ages
149,the hereditary nature of the qualities and the suitability of an organism to its environment and viceversa all of this is true observation
150,and that true observation about heredity is in the end enough you don’t need more than that to utterly crush all the designs and vanities of the bugman
151,the bugman fears heredity and nature not darwin
152,6 you must understand that the evolutionary psychologist the evobiologist the darwinist in generalmost such people are very good and even great minds who are just misled by the fightplays a game of baitandswitch
153,many times he’s not aware he does this himself
154,he believes in darwinism as a teleological faith that reproduction and survival are the ends of life the purpose toward which all life strives and that this explains how life or an organism behaves and also how it is adapted to its environment
155,but when you confront him on this he will deny all notion of teleology
156,he will say he doesn’t believe in any of this but only in a material mechanism of natural selection
157,through this mechanism those organisms that are not in keeping with demands of environment at some time are slowly pared out
158,by a process analogous to our breeding of animals like dog and horse nature itself breeds organisms and life this way and that by accident
159,there is no end or purpose he will say you are crazy
160,but then when he’s not paying attention he will talk a different way
161,they all do this
162,he will start to say that this or that animal is behaving this or that way because it is trying to secure either reproduction or survival
163,he will explain physical features in this way too and when he really forgets himself he will make a moral principle out of it
164,the most honest ones when they trust you will talk about replicating themselves as an aspiration and a goal
165,this is human all toohuman but also very natural because it’s very hard to talk about biology or life without teleology or some consideration of ends or purpose
166,clearly physics and chemistry seem to be driven by no purpose or goal
167,but animals seem very much driven by motive or purpose and is hard to explain a biological feature without reference to its end or purpose
168,so the darwinist forgets or tries to change the topic all the time he knows what is really interesting is the question of what drives life what explains animal behavior and what explains the correspondence between organism and environment
169,this is the question
170,the mechanism of heredity or the means by which a species is shaped natural or unnatural selection which is really darwin’s only insight is the least interesting part of all
171,actually it is a tautology yes only those animals who have managed to reproduce actually pass on their traits
172,something every sheep breeder in history has known
173,but that this alone explains animal adaptation or behavior is nonsense
174,7 there is alpine mouse that collects food for winter
175,somehow it knows exactly the proportion of poison herbs to include in winter stores to preserve them
176,too much and the food it gathered becomes poison too little and it spoils
177,there is example schopenhauer gives two insects and one will kill the other on sight
178,yet this other presents no immediate danger to the first but will only eat its eggs in the future
179,how does that first insect know this
180,it is not taught nor does it see
181,it has very primitive nervous system
182,it knows this somehow “in the blood” this is a very specific and complicated behavior
183,there are many such cases in nature
184,creationists have focused too much on complicated physical features but even for something like the eye or the bacterial flagellum it is possible to construct stories of how they evolved gradually
185,i don’t believe those stories they sound improbable and madeup but they’re more believable than the stories you have to make up in the case of behaviors
186,and many more
187,so many animals and simple insects have such complicated behaviors they are born with already
188,at some point the incremental explanation becomes so convoluted it is hard to believe
189,please remember that aristotelianptolemaic system for calculating motion of planets and so on worked quite well for long time
190,it was abandoned because ever more convoluted explanations had to be invented to support the fundamental and wrong assumption of geocentric model
191,evolutionary theory today is slowly in same position and nowhere more than where they may try to explain inborn behaviors of this kind
192,it is obvious that such behaviorsif you want to call them “adaptations”came about as we see them now complete and without significant incremental change
193,how did such “miracle” occur
194,this is not creationist booki do not believe in that
195,nor do i believe in the “miracle” that modern science has invented hiding under the word “random mutation” and the handwaving of “incremental change” there is not enough time nor enough number of specimens nor the kinds of “mutations” observed to support either natural selection or lamarckianism as explanations for evolution
196,many of the mathematical models for how a trait will spread in a population have failedthey don’t tell you this
197,no i don’t talk about miracles whatever words you put them under
198,and the “design” is there but it is by no means benevolent or intelligent nor comprehensible
199,you see in the spider’s web a creature of rudimentary nervous system and little intelligence “design” something beautiful and complex and this is key to understanding also all of nature
200,there is an inherent “intelligence” inside things uncanny silent and demonic
201,its workings and aims are obscure to us
202,our own intelligence is only a crude deviation of it an approximation
203,there is an “intelligence” in all things and inborn in our bodies before anything to do with the brain or the nervous system
204,and all “adaptations” no matter how much natural or unnatural selection may have gone to spreading them within a population occur not by random but by a spontaneous correspondence of some kind between the organism and the environment
205,some day we may discover the material cause or manifestation of this correspondence or the chain by which it travels from the rockface and the elements of brute matter up the forms of lifethere is some asyet undiscovered “signaling” system
206,but the adaptation by no means takes place at random nor even primarily by natural selection which is just one of the means by which it spreads in a population
207,8 a truly objective or scientific approach to life would be to start without assumptions
208,make no big stories
209,take animal and study
210,study what it does in nature not lab when left alone from human
211,study different specimens the mood the behavior at different time of year in different places at different levels of fortune and wellbeing
212,make no assumption about what it wants ultimately study how it behave today tomorrow in the moment which is only thing that exists for animal
213,look inside its brain
214,study its hormones and its internal states with great care and with clinical objective eye correlate these internal states to what it does or what it’s driving atand driving at that day or in that moment not what you think about “reproduction or survival” this is true path to understand animal adaptation behavior and life
215,there is some of this done but much too little and not well
216,in the end are you so different from goat dog or even ant that you look at such beings and really remain puzzled
217,for sure the real research i just named must be done if only to convince the boneheads
218,but the behavior of an animal would be a complete mystery to you if you weren’t very similar yourself but we understand right away a bear angry at bees or playing under whitesilver birch in thick of forest or lizard frightened and winding between rocks why it does what it does
219,it is no mystery to us who are also like them
220,we love dogs because they express so honestly and without dissimulation what we also are and want
221,they and other pets calm us because promote a kind of carelessness normal to animal life unencumbered by thoughts of the past or worries about the future none of which actually exist
222,women are in their natural state close to this condition as well or closer on the whole which is where they get much of their charm and power from the modern education that teaches women to be hyperaware anxious for the future abstract neurotics etc actually takes away their power to a great degree while tricking them into thinking they are being tough or sassy but a hyperconscious woman is made powerless and charmless
223,but study must be made of inner state of animal now in this condition now that
224,what anyway would objective study of an organism say
225,what does life want
226,9 darwin and his style of thinking would never have made so much impression or ever had such power if it were simply false
227,actually darwinism is true but only under certain conditions
228,it’s not even a “halftruth” it’s actually the full truth about a kind of life but the mistake is to think it describes all life
229,darwin is meaningless without malthus but this is why nietzsche is right about both of them when he says they describe only life in england or more precisely the england of that time
230,the beginning of the industrial age and england as the first nation that solved the problem of infant mortality these are the relevant facts
231,england was able to colonize so much of the new world because it was the first country to solve this problem
232,many criticize in some way the spanish or portuguese model of colonization but you must know the portuguese had a population of one million when they began the age of discovery with henry the navigator
233,and of that population many fewer were young men who could embark on voyages of great danger some say up to a fourth or more died on these voyages alone
234,they had no manpower to settle faraway lands but continued the old pattern of “elite dominance” where brotherhoods of conquering men often took local wives and such
235,by contrast the english could now transplant entire populations being surfeit of huemans
236,but it was still not enough
237,the cities became crowded the filth unbearable as the lowest classes swarmed the monstrous new machines of industry
238,the living conditions of workers well into the 20 th century were purely hellish marx and his followers at least were right about that and that’s why they could prey on this condition
239,it was a condition of misery and destitution similar to or worse than we see in the shantytowns of the turd world
240,solution to infant mortality problem meant these lower classes put all excess income into supporting more mouths to feed not improving the quality of life of the children they had just an exponential increase in human biomass
241,and this is the world of malthus and of darwin life under filth life under distress
242,darwinism describes life under extreme stress
243,from this very partial view he thinks he has discovered the truth about life in general but animal under conditions of extreme stress crowded condition observed and watched filthy beaten and imprisoned its life severely regimented away from what it would like to do if left to its devices will not give you secret to what life is
