,0
1069,all of these believed that inside us is a spark of divinity that is trapped in matter
1070,since matter and this world are the work of an evil demiurge the laws governing matter and human life as they appear especially in the bible are the laws of satan
1071,therefore to free yourself you must overturn every single one of these laws you must engage in every act of evil every crime every atrocity only in this way does the gate open out of the kingdom of shadows only this way you find paradise and get past the angels guarding its paths
1072,i don’t recommend this way
1073,some say much of the left is motivated by such a faith its secularized variety
1074,there are in the case at least of frankism some weird historical peculiarities many of the prominent leftist jews the founders of the most aggressive leftism at least are said by some orthodox jews to be of frankist origin
1075,this was so in the case of brandeis hardly the worst but supposedly there are many others
1076,i myself don’t believe this though it should be studied
1077,i feel a kinship to such sects but this not direct i must explain
1078,in general you can understand gnosticism in all its forms in this way the hebrew faith is based in claim “saw that it was good” the claim that the world is crafted by a benevolent god and that matter and the world is good
1079,there are only a few other faiths like this islam is another and schopenhauer claims greek and roman paganism are same although this is not the full truth
1080,greek optimism is of an entirely different sort than biblical optimism anyway
1081,but hinduism and buddhism see the world as something you must escape they believe in nirvana or moksa that frees you from the cycle of rebirths
1082,this is more normal and a lot more widespread in history
1083,and this is in a sense true since suffering so obviously outweighs its opposite in any individual life this is true where moments of happiness are rare and pass quickly
1084,but also if you imagine the pleasure of an animal eating versus the pain and agony of the animal being eaten you can’t be fooled you see that suffering exceeds pleasure or happiness in this world by many magnitudes
1085,many bears some african hunting dogs and others they bite out of animal before it is even dead
1086,best like i said to be killed by jaguar that dispatches you with quick bite to the skull
1087,its jaws are strong grown to bite through turtle
1088,i believe it’s the most compassionate cat but most murder in nature isn’t like this
1089,houellebecq talks about how as a boy he couldn’t stand the selfsatisfied dronelike and calm “reasonable” voice of narrators on nature shows that try to obscure the worst agonies of animals murder in blood
1090,according to any rational calculation life is not worth living because pain far outweighs pleasure
1091,heavily medicated nihilists are likely to deny thisthe blessed and happy know it’s truebut also know that reason and rationality are false
1092,gnosticism is driven by the problem of suffering or compassion for those who suffer and tries to absolve god of responsibility for this state of things
1093,sometimes it says the god of the bible was put to sleep or imprisoned himself or that he is bound with chains of adamantine and kept in a cage and that a usurper took his place
1094,other times it says that the god described in genesis isn’t the real god but a demiurge and the real god sent his emissary jesus to overturn the rule of this demiurge
1095,there are many variations and some interject not one demiurge but ninetynine all to remove responsibility from the godhead for the creation of this world of evil
1096,they should have just become buddhist or hindu and stopped trying to save the mythology of canaan
1097,maybe in its beginnings the christian faith was the same as the buddhist and this is now lost in the confusions of hateful sects that distort history
1098,it’s easy to think that this is the religion of a hopeless age that it’s a byproduct of the decay of the roman empire and the symptom of despair or suffering
1099,it’s much worse than that
1100,the problem for man as for other animal isn’t stress or suffering but the feeling that one can’t escape the despair and panic of exhaustion and entrapment
1101,beyond the borders of the known inhabited world the oikoumene there lay uncrossable oceans including the great earth ocean of the steppe and the sahara in the other direction
1102,china and india were known and trade existed but this was only a vague knowledge that could have in theory stimulated the sense of conquest and adventure
1103,there were in other words plenty of possible sources for the feeling that beyond the known world still remained the unexplored
1104,the same unknown that called the enterprise and spirit of the portuguese spanish and other europeans who set out on a colonial mission of worldconquest and discovery all of this existed in late roman times
1105,but the will or spirit was not there there was only exhaustion on all sides the same exhaustion that explains the pointless history of china india and all long settled farming places
1106,civil wars and palace coups will always continue but the spirit of man is broken by habituation to an overlong domestication and nothing genuinely great in body or spirit takes places again after a while
1107,this “habituation” includes of course those “habits of the blood” which leads to the breeding and overproduction of the superfluous
1108,once a great power imposes domestication on its neighbors and then itself comforts grow and so many are born who experience life already at birth in an exhausted state and who call upon themselves the governments and religions of the exhausted and stressed
1109,surely the external obstacles we face now are far greater outer space for us is not traversable even in theory and we know of nothing on the other side of empty spaceeverything outside the already known seems barren
1110,and yet i repeat this kind of physical limitation isn’t the real cause of a spiritual exhaustion that yearns for escape of some sort
1111,it is the very character of domestic life to present the world as an enclosed owned space and although mankind adapts itself on the whole to this condition both biologically and culturally yet there remains a glimmer of the opposite tendency inside even the lowliest
1112,he can’t help but experience this new state of things in late civilizations except with dread the dread suspicionan uncanny suspicion that the world is artificial
1113,he begins to sense that this hothouse he lives in is the malevolent creation of a demiurge that likes to observe our sufferings that he and his minions feed on them
1114,in the remote future should the evil of human innovation continue unchecked we really will live in the world the gnostics feared and that spark of vital life and energy that is the gift of nature to all youthful peoples born from its womb that spark will remain entrapped in “matter wrongly configured” matter entirely foreign to its inborn desires and workings but fashioned instead for the benefit of something else
1115,in many ways the world we inhabit now already anticipates this living hell of the gnostics and the response of those in whom the pain of civilization and modernity is most advanced the transsexuals unwittingly help to further uncouple reality from nature and to make our progressive domestication more totalitarian and aggressive
1116,and yet for yourselves who wish to fight the encroaching tyranny remember that in conditions of crisis the “carpocratian” option the attraction precisely to the criminal and deviant can be very great butone here is at the edge of the abyss
1117,and the way you interpret the call of this instinct 46 i am interested in the falsification of history and possibly of geography
1118,i think mankind is exceedingly stupid and wicked you can’t trust a word you receive
1119,i have no doubt your religions are true but can you be sure some vicious faction didn’t insert itself into the hierarchy of priests some time ago or of religious authorities or of book printers and insert all kinds of things that weren’t there to begin with
1120,for example all old slavonic copies of the bible in russia used to have heavy gnostic interpolations
1121,this explains the multitude of such sects that sprung up there including those who castrated themselves and others like the duhobors who make a mockery of the higher and noble nudity by practicing the nudity of the deformed
1122,in the west there were similar things how do you think the cathars found such currency in north italy in the rhineland
1123,it wasn’t just a new teaching but very old practices and old formulas that found a ready home among a population long prepared to receive them
1124,some were pre christian while others had spread along with the early church and preserved elements of early christianity mixed in with manicheanism and magianism and other even stranger things
1125,why do you assume then that the main religions that survived are not in fact forgeries
1126,islam could very well be such a forgery the koran is a mishmash of nonsense and possibly was originally a syriac christian devotional book that was reedited much later
1127,mohammed was their name for christ and the faith originally was a version of nestorianism that was spread by the persian king not by arabs
1128,the entire history of heraclius’ crusade against persia as of persia’s downfall in “battles” against arabs may be entirely fabricated by both sides though of course now this lie has long been forgotten
1129,what historical or archaeological evidence is there at all for the existence of a mohammed
1130,but do you have any idea how speculative the conclusions drawn from archaeology are in general
1131,just read for example the kind of “evidence” they used to establish horseriding on the great steppe before 1000 bca few maybe not even five or six bones that seemed to look like bits
1132,life is short rebirth as a man is uncertain and may happen a billion years from now to these pitiful liars to trust your only life
1133,look at thucydides who is a great man and a genius of the ages he seeks to outdo herodotus and this pattern is followed throughout all antiquity
1134,each great historian was setting out to outdo his predecessor as a rival
1135,do you think they made some things up
1136,how much do you think then that the scholar the scribe the vain “monk”the “nerd” as a type is likely to lie
1137,they will lie far more than you thinkthe nerd more than a thucydides is possessed by infinitely greater mendacity and also vanity jealousy spite and pettiness
1138,don’t you think such people who for the longest time in the form of the monk were the only keepers and copiers of texts from antiquity don’t you think they would be willing to change the text to add and even to make up entire books and authors
1139,corroborations from “third sources” would be relatively easy to manufacture as well
1140,but anyway josephus uses this rivalry among the greek writers to cast doubt on greek histories in general and in this he’s not entirely unreasonable
1141,of course where he’s wrong is in supposing that the centrallycontrolled archives of the other peoples like the egyptians the babylonians or his own are any more reliable
1142,nietzsche refers to the falsification of the history of israel that occurred at some time before josephusand i think he was referring to the maccabees
1143,there is no external record anyway of the jews existing before the kingdom of the maccabees herodotus never mentions them
1144,but there is evidence that the falsification nietzsche was referring to is even of a later date
1145,much of antiquity could have been invented by sects or orders of christians or even jews to make it look like their contrived and artificial utilitarian religions had some basis in human nature or were anticipated by wise men in the past
1146,when in fact the entirety of their energy was directed toward suppressing the natural spirit of man the innate reverence of man for the magnificence inside animals and inside things
1147,in the end nothing can be trusted that you can’t see and feel yourself
1148,47 we don’t know if all of antiquity or maybe if large portions of it was entirely made up by medieval monks or by italian humanists in the renaissanceor if some eccentric scholar at constantinople or a monk in iberia added entire books and passages to plato or to others
1149,when nietzsche says that plato “studied with the jews” in egyptwhat does he really mean
1150,could it be as some have said that the jews are actually themselves a recent invention a sect of the arabs in cordoba and that this group made up parts of plato or of aristotleor so heavily corrupted their worksperhaps working with scattered groups of monks in europe and with the vatican later
1151,what is the vatican and if it didn’t exist before say the year 1200 how could you be sure
1152,machiavelli mentions that st gregory wanted to entirely destroy and blot out all prechristian culture and that these bearded men in black robes smashed temples in their hysterical rages crushed statues burned books
1153,how do you really know how successful they were or when this actually took place
1154,how do you know that the legacy of the ancient world that machiavelli claims they preserved only out of necessitybecause they shared latin as the same languagewasn’t almost entirely corrupted by their “transcriptions”
1155,every new form of life among mankind seeks to blot out the memory of its predecessors to rewrite the history and maybe does so literally corrupting the texts themselves
1156,is there any evidence the desultory and unfortunate “doctors of the early church” ever even existed
1157,augustine is almost surely a complete fiction and there never was any such manhis pidgin “greek” is nonsense in that area to begin with and is rather the makeshift greek of the medieval monk maybe living somewhere in burgundy
1158,you don’t need to go that far though
1159,i’ve heard other less strange but still wild theories that the new testament was written by a jewish woman as a parody of greek tragedy
1160,it was an effort to overturn roman life and power “roman privilege” by means of the passion storythe dead god as an inversion of greek mystery cult surrounding dionysos
1161,does this sound familiar in our own time when monstrous historical hoaxesincluding the socalled and entirely fake “cold war” during which the united states was funding and arming the soviet union the whole time
1162,if nietzsche believed such things he would have never put them under his own name or said them openly but could it be when he says that plato is ungreek that he really means precisely this
1163,was plato or at least many of the works of plato the invention of a byzantine polymath or of a benedictine
1164,such speculations are the opposite of comforting especially in a world where the consolations and certainty of religion are rare
1165,history has somewhat taken the place that religion had i mean to provide stability to a world that is otherwise lost in complete confusion and chaos and uncertainty
1166,i want this chaos because what i want to bring thrives in it
1167,the continuity of history if not its progress is that last thread that secular scientific man unmoored in the universe on this floating rock the play of titanic and foreign forcesit’s the last connection that he had to any sanity
1168,i want a world of psychosis i want the end of his sanity
1169,what if there is no firm ground to what we receive from history and the continuity we think we have is actually a jumbled and confused messthat events from antiquity have been confused with events from the middle ages for example
1170,i found the suggestion of fomenko that the crusades and the trojan war were really the same event to be so disorienting that i had to act out in a very vehement and stern way that day later
1171,at the lounge when the bouncer asked me if “i was on drugs” and i pushed his forehead away from me in a gesture of majesty and power
1172,i was soundly beaten up by his goons in the alley
1173,the speculations of anatoly fomenko as well as the socalled “phantomtime hypothesis” which claims that three centuries have been wrongly added to our chronologythis is small stuff
1174,it’s very smallfrom these doubts i was led to many others far more horrific
1175,i’ve lived a wandering life and at times i was confused by a strange similarity between certain street corners the smell of this and that building that i supposed were different the uncanny likeness of two streets that years later i can’t tell anymore which was which or if instead i dreamt it
1176,i believe it needs to be investigated for example if mexico city is not in fact the same as bangkok and the socalled baja peninsula not the same as the malay
1177,the similarity of dishes like mole and thai curries only lends further support to this hypothesis as does the kwak’ ing language of the oaxacans and chiapansit’s the same as laotian
1178,i’ve heard rumors that as you go inland from portauprince you start to see the lights of manila and that the caribbean islands are no different from the philippines
1179,both enjoy the grilled pork the rice with cheese delights like spaghettis with ketchup and hot dogs or spam and i hear certain other things also
1180,the slums of bangkok are the same as those of mexico city and cambodia is the same as guatemala honduras is entirely fake
1181,thus it is said in some corners when columbus came upon cuba it really was cipangu or japan and he really did discover asia
1182,the entire new world and many other areas of the world also is thus a fraud of the first order
1183,shanghai can be accessed in two hours from manhattan by secret bullet train
1184,and if you ask how it is that so many travel by plane well it’s not so hard for there to be an understanding among the relatively few active pilots to keep this a secret and use circuitous routes to make flighttime seem a lot longer
1185,if you don’t want to go this far remember how they can nevertheless keep entire continents or islands a secretyou’re not allowed as far as i know to approach the north or south poles and it’s not out of the question that a tropical refugium exists in both
1186,there is an esteemed scholar from bangalore who points out that the year in the vedas has six months of daylight and six months of darkness
1187,48 but you think i’m promoting idea of “noble savage”
1188,do you understand your visions of what is “noble savage” are just a miniature overspent china a spiritual china on a smaller scale
1189,i know there no such thing as noble savage mark twain attacked the red man as a faithless liar and rogue
1190,well fine
1191,that doesn’t bother me my idea of noble and vital power is different
1192,butchoose whatever view of nobility you will it doesn’t matter you won’t find it among primitives as a rule
1193,you idolize peasants
1194,you look up to island savages living “at one with nature” i ask you to see what happened to margaret mead and how the polynesians punked hermost of the things she wrote about their views on life about their sexual freedom was nonsense they made up to make her look foolish
1195,in same way the fools like gimbutas and others who believe that mankind at some remote point lived under a benevolent matriarchy again “at one with nature” in balance with the needs of the soil and such sheer nonsense
1196,everywhere historians archaeologists find what we thought was matriarchy was really no such thing
1197,you see this in the odyssey where it is clear that the right of succession belongs to he who is husband of penelope and odysseus’ son telemachus isn’t assured of his inheritance of the kingdom
1198,local priestess of the rites of fertility of the flowering and blooming of the seasons of the earth who made crops assured to spring from the soil priestess of the local earth goddess or spirits whoever married this woman was given a certain prestige or legitimacy as king
1199,this much is true but it was men who decided who she married and they decided the sovereignty of the kingdom as well
1200,everywhere you look to find any kind of formal matriarchy you see that in reality it was nothing of the sort but something very much like this
1201,when you find polyandry as among some inhabitants of the himalayas it is men sharing a woman for lack of resources or because of some other circumstance
1202,by what mechanism could after all women rule since they are so much weaker physically and seem unable to politically organize without men
1203,butbutthere is way for them to rule
1204,and so the debunkers of matriarchy are correct but don’t see far enough into social relations among primitives and even the civilized to realize that matriarchy of a sort is a reality
1205,i already spoke before of one kind
1206,but you find among the chinese the sicilians that household is run by grandmother
1207,when many of you moderns pine for “communal living” and talk about inter generational householdsyou seem to forget that this would mean subjection to a strongwilled dragon or gorgon lady
1208,the modern girl when she pines for the community of the premodern extended family imagines that she gets from it the emotional and social support of her female cousins and a crew of servants in the grandmothers not the realitywhich is utter subjection to the motherinlaw
1209,the modern southeast asian whose ancestors have lived in oriental “cities” for generations is completely beholden to his wiferead any anthropological study written before 1970 to see the truth about asian social life
1210,in africa the men are utterly defeated and beholden to matriarchy in complicated ways the women run all food production without the help of the men who rely on them for the daily ration of bland sop mushed up from grains
1211,at times to break this monotony they seek bushmeat but they mostly live as farmers dependent on big armed woman tending messy patch of roots
1212,the entire social life in this area is managed through secret societies
1213,the apparent political power is brittle and meaningless interlocking secret societies based on the manipulation of black and white magic are the true source of all important decisions reached in the village and even in the cities
1214,women play a prominent role in such societies or outright rule them there is among them a long tradition of respect for woman as oracle which is only natural
1215,the yoruba water priestess chimping out in ecstasies over the boa receiving visions this is not so different from the pythia
1216,but where the pythia had submitted to the solar and boyish manliness of apollo such a conquest of the power from under the earth never took place in africa nor in many other places
1217,and so here as elsewhere there is a kind of matriarchy but it works covertly so that both the “left” and the “right” are fooled on this point
1218,in the end then the “left” is more correct the worship of the titanic powers of the earth of the great mother is connected to a kind of matriarchy but where they’re wrong is in imagining that this leads to any kind of freedom that it represents a kind of liberation from the strictures of modern civilization the pain of specialization the submission to moral authority the modern “alienation” and every other thing they like to blame
1219,in fact everything that you hate about modern life and that makes it into an iron prisonand i agree it is a prison represents a return of the endless sallow night of matriarchy
1220,it is a return in every way you must understand this literally
1221,nietzsche says that in the modern europe you see the reassertion of prearyan modes of life the return of socialism of the longhouse of feminism and that this is happening also to us internally where the higher instincts of the spirit are being overtaken physiologically by the retrograde and prehistoric
1222,the life of the village and of the primitive is one of utter subjection total domestication and total brokenness
1223,the “matriarchy” that does exist and that exerts enormous influence and power in the social and moral realm is only the manifestation of this brokenness of the males
1224,communal solidarity absorbs and snuffs out any personal distinction or intelligence and this task is relatively easy where it concerns the majority of the parts of the village the real problem becomes what to do with the young males
1225,in every way they represent a threat to the established customs and the physiological torpor that benefits the old and the women
1226,the social problem in primitive tribes as well as most civilized and unfree societies becomes this what to do with the young males their aggression their sexual instincts in every way they must be broken and subsumed for the benefit of the tribe
1227,this is more or less easy for the majority who lack life force in any significant quantity harder for the remainder and where impossiblethe fate of the outcast or more likely death
1228,you fool yourself if you imagine that “young males are needed for protection from external threat” in fact most societies of the settled primitive and as well as civilized are more than willing to accept the risk of submission to an alien tribe
1229,in a given area if many such tribes follow this same path of self domestication the risk is hardly even that great in one’s own lifetime and a few benighted spineless “warrior” drones are sufficient to contend against similar neighbors
