,0
587,they pay lip service to “supremacy of the desires” or to biological determinism but they still believe they are their intellects just imprisoned by flesh and matter and genes and a biological “programming” this is wrong
588,and it’s not the intellect that is reborn i will tell you what is
589,take a fruitfly or a worker ant
590,this type of being is very close to plantlife in some ways
591,it has very primitive intellect very primitive nervous system
592,there are inborn ways of behaving of reacting to certain stimuli inborn desires and orientations “in the blood” and when you kill one ant the next one over will be identical in this regard
593,its rebirth is “instantaneous” because the ant has a will that is shared uniformly across its type in the hive and is therefore persistent and enduring
594,once the queen dies the next queen is indistinguishable from it in that thing that schopenhauer calls the will what he says is inborn way of wanting and is in a very literal sense a “reincarnation” of this same thing
595,if you don’t see this it’s because you keep confusing yourself for your intellect
596,but that part of you that is really you persists even when your intellect is asleep and would persist even if you experienced total amnesia
597,if you doubt just ask yourself someone you love if you had to choosewould you rather they forgot everything but still behaved the way you always knew they did or would you rather that they kept all their memories and knowledge but had a radical change in personality
598,this question is easy to answerif you love someone only for what they know or remember everyone knows this is a betrayal because that’s not who you are 
599,and in fact there’s no such thing as a radical change in personality
600,the lower forms of life are nearly uniform in their wills or inborn ways of acting and also very simple in the case of amoeba yeast and such they are not far removed from the behavior of the natural forces like gravity which is completely uniform and persistent
601,once dead they are immediately reborn and indeed live simultaneously in numerous bodies
602,for higher and more differentiated animals the will appears more particularly defined for each type species and finally each specimen when it comes to the human
603,but this biological reality independent of what is known remembered or consciously decided is a matter of the blood and body and this same being thing or will call it what you will will be reborn in just the same way
604,in a different time but this same particular way of desiring and behaving that is inside you will come again this is the real meaning of reincarnation
605,and with the glut of humans in our time we have to wonder if the same being also lives now in multiple bodies sometimes
606,where do these beings come from
607,some have said that these new billions of huemans that in a previous life they must have been yeast amoeba locusts and other insects that are born in multitudes in each season
608,i’d like this to be true but i think rather that in previous ages mankind also swelled to many billions or even more and also i have no doubt the entire universe is teeming with life of all kinds
609,27 it would be interesting to know what the “extinction” event or path is in each previous human cycle of civilization
610,if it is something completely random and external like asteroids or volcanoes or if it is something inherent to civilization as suchsome circumstance or behavior that leads to virulent disease or some kind of great weapon or maybe even something more uncanny
611,i wonder if the peoples and religions that exist now also existed in past cycles under different names with slightly different superficial circumstances and appearances but in all fundamental ways otherwise the same
612,and if one or a set of these or some new belief that hasn’t even appeared yet is the cause of the end of civilization in every cycle
613,a frog once suggested to me that the explosion of african populations in our time is the event that the movie alien describes a population bred under the most extreme pathogenic load and that despite its weaknesses in cold weather can nevertheless wreak so much damage on the rest of the world that societies collapse under the march of the zombi i personally doubt this
614,asia will shut them out without glancing twice or hearing of their suffering
615,i think instead the end in previous cycles has varied but that very often and most interesting one cause has been the emergence of brotherhoods of savage men who have decided to purify the earth and rid it of the infestation of the human cockroach
616,because unfortunately in the long run the development of civilization and comfort leads to the proliferation of damaged life the innovation of mankind leads to unspeakable abortions of life and men on the periphery who want to preserve the natural order begin to plot the end of everything
617,i also wonder if some ancient civilization has managed to escape all these cycles of destruction and has hidden underground somewhere
618,maybe they are really eternal and live life as an experiment detached seeing it as a playful dream they can observe at a distancemaybe an emissary surfaces from time to time so they can amuse themselves
619,i shudder to think though that by this same reasoning the aborted robot life to which the mass of mankind inevitably degenerates in each cycle of civilization also survived maybe in small communities of “moles” inside dry hills of limestone or not far underground in old networks of caves and tunnels
620,no doubt stories of vampires kobold cryptid humanoids and many others might refer to these degenerated stragglers that prey on us and terrorize usno doubt many among the ranks of deities have come from both types and stranger things still exist under the earth
621,please see deros if interested
622,there are more things
623,28 there can be no “artificial intelligence” in the way that people really mean it
624,if they mean some machine that approximates the intellect of man this may be possible and even very useful although they’re very far from their goals at the moment
625,success at chess is their one great achievement but they fail still at kicking a ball pouring ketchup recognizing simple objects could one hunt or survive being hunted
626,but they never mean just the intellect in this way or a crude approximation of it when people speak of “artificial intelligence” what they always mean is artificial life a robot of some kind or an artificial consciousness indistinguishable from human consciousness
627,there is an apparently different but in fact similar speculation that nerds love that the universe is “logic” or information
628,that what constitutes matter can in fact be recorded as “information” as relations of logic and that therefore the universe must be precisely thisthis is behind also the belief that you can “upload” your intelligence to a computer and attain immortality and many related forms of imbecility
629,the motivation for this is nerdishness and also somewhat the jewish way of thinking or the judaizing tendency that promotes facility with words and number but approaches mental deficiency and even retardation when it comes to anything visual
630,the jewish hatred of matter an ancient prejudice that precedes the bible and the hatred also for beauty that they share with other semitic peoplesand many others besidesall of this comes together to promote this kind of aggressive nerdishness
631,this is the origin of many of these claims though it shouldn’t be imagined that here or elsewhere i am referring to all jews or that this absolves nonjews
632,because the “judaizing” tendency i talk about is inherent to human nature and is very common also among nonjews and in some degree it exists within everyone together with the counteracting love of vibrant matter image and beauty
633,it just exists in different degrees in different people and peoples
634,in any case all of these delusions that you can be “uploaded” because your “brain” can be uploaded that “the universe is information” or that something like “artificial intelligence” actually can exist are all at bottom the same delusion and the same power fantasy of the nerd
635,the nerd can be described as a person of inelegant and pedantic intelligence often middling intelligence who takes excessive pride in the intellect even in the memorization of facts the design of clumsy concepts to which reality is then expected to fit like to bed of procrustes
636,and he identifies with it
637,there are very rare people in history even a few saints and martyrs who were ashamed of their evil character and will and sought salvation in contemplation sought some escape in this
638,these are sometimes noble people but this doesn’t describe the nerd
639,the nerd doesn’t hate himself his nature his tendencies or spirit nor is his intellect powerful enough to overawe his needling will and consider things without the pressure of interest or the gravity of petty desires
640,he never sees things like the true genius or the artist does when the perceiving part of the intellect becomes so powerful that it really overpowers everything elseso that the fullness of the object occupies all of consciousness and an idea or some new insight into the world is actually grasped
641,no the nerd is a creature of will under the direction of a petty will in the everyday sense and all of his thoughts concepts and designs have a forced quality because they refer always to need and desire for some kind of gain
642,this very often is just material gain but the desire for prestige is even worse
643,in men of intellect the desire for prestige is often the most disgusting especially when there’s no native manliness because this leads to cowardice and lies to others and oneself
644,for this reason nietzsche said manliness is the first requirement of the philosopher but there’s no one farther from the philosopher than the unmanly nerd and there’s no enemy more implacable of the human race and of the genius of the species than just this nerd and everything he represents
645,the attempt to “mimic” life through algorithms through the bruteforce of trialanderror will never create either life or “consciousness”just what would such a machine be “conscious” ofbut just that a mimicry or parody of the middling human intellect
646,a mirror and exaltation of the false intellect of the nerd that never leaves the stream of words syllogisms motives and desire that is always forced and contrived because it’s under pressure of some petty need
647,and it’s really grotesque
648,it’s as if you have a girl you desire she dies but using big magic you reanimate her corpse put makeup on her reteach this zombi to speak force her to copy all of her old habits condition her like you would a pigeon to act in ways you remember and that you liked
649,but in the end she’s just a reanimated liveaction doll and this is grotesque
650,this is just what “ai” is
651,it is a fantasy of power of the conspiracy of biological interests that unites the nerds the intellect of “reason”the party that believes in empty wordsthe middling and the jews of the human spirit into hoping for their golem
652,“ai” is the golem of those who hate life
653,it is their true messiah and their vengeance
654,29 youth and beauty are universally hated in almost all human societies in history
655,these societies are run by decrepit sclerotic old men
656,sometimes they use image of fat woman “earth mother” to beat the young men over the head with and make them submit
657,other times they promote ugliness in all ways ugliness and perversity in custom scarification circumcision selfmutilation
658,customs and religious authorities that concern themselves with how you should wipe your ass brush teeth how many fingers to insert in anus to achieve such and such “magicalmedical” goal petty legalisms of all kindsthe shiite sect among muslims and rabbinical judaism are most like this
659,all of this smothers genuine religious enthusiasm and the true oracular science from which can evolve arts of great beauty
660,often their food is unappetizing and looks like boiled rocks
661,their languagesmost human languages are so hard to listen to
662,tagalog is almost torture to hear though i don’t mean to single out this culture it’s hardly the worst in terms of love of ugliness actually the filipinos can be a pleasant people with an impish sense of humor inherited from the longlost negritos now absorbed in their population
663,their people are ugly millennia of arranged marriages for financial gain among the indiansoriginally a noble peopleled to a nation now of one billion that almost never wins any athletic contests that has won fewer gold medals since its inception than tiny croatia has since 1992 where both the men and the women are inbred ugly unsexy and almost deformed
664,i don’t mean to pick on them because they’re hardly the only ones and this ugliness physical ugliness is almost universal in the human race
665,beauty is the very rare and precious preserve of tribes that have striven to promote childmaking for something other than financial social and political gain
666,no the promotion of ugliness is nearly universal and the love of beauty is so rare among the great civilizations only the ancient greeks the french the japanese and somewhat the italians are true lovers of beauty and refinement and have based their existence exclusively on the promotion of beauty
667,how many times in history have cultures become ugly and petty because financial interest overrode eugenics in marriageand free love though not perfect is somewhat more eugenic than letting fathers trade daughters for personal gain
668,in their hatred and distrust of beauty one feels such societies live under a tremendous pressure of needs
669,their true ruler is the god of gravity and they are dominated by fears of the future unspeakable anxieties about money and matter and importune brutish behaviors all motivated by need by the desire to grasp by the feeling they all nourish that they’re being taken advantage of
670,they always feel they’re being disrespected
671,the desire for respect is the true mark of the foreverslighted
672,the distrust of beauty is sometimes sold as the highminded rejection of material desire by the saintly or the kind or the contemplative
673,but that’s just nonsense and you can see it in this way
674,beautyhating cultures have one other peculiarity they all share which is very revealing
675,they hate also privacy and personal space they hate also beauty in good and refined manners
676,these societies are based on such popular solidarity that it’s considered normal to barge in on other people absurd to demand to knock they make animal sounds when eatingor the way such people are often said to smell in history whenever such societies are encounteredall of this tells you what the hatred of beauty is really about
677,freud refers to the inner pain many of his clients experienced trying to shift from this kind of medieval collective smothering culture of ugliness to one where personal space and distance refinement and beauty were instead valued
678,it’s about the hatred of distinction or superiority hatred of the principle of difference and distance between individuals  that is by contrast so prized in those very few beautyloving cultures
679,and the hatred of superiority comes from the suspicion the many in such beautyhating societies feel that in not being subject to the horrible pressures of need and anxiety under which they themselves live that the beautiful and carefree make a mockery of what they take most seriously
680,the beautiful threaten to unravel the regimentation under which they must subject their constant crude need for things
681,this is why such societies descend to the lowest types of faggotry whenever their native laws are even slightly relaxed
682,islam is most like this
683,jews when devoid of their religion as well as persians who live under the tyranny of shiite law and most of all the people of the gulf states all revert to a crude animal condition without their rigid laws and become completely dissolute as the arabs were said to have been before islam
684,and they will soon return to this
685,i don’t need to add notes for spergs and pedants men like john milius are excepted from such judgments but their existence has nothing to do one way or another with my point here which is about general types and the ways these generate
686,i am speaking of two opposing views of life that are based in two very different needs of two very different biological orientations
687,there can be no compromise between those who live under the pressure of need and of material increase who are the walking shadows of the dead and on the other side those who are carefree joyous pleasureloving and worship beauty
688,one seeks the preservation and expansion of mere life the other seeks the exaltation of life
689,30 among the greeks the man of power was called aner who was different from the other word used anthropos which referred just to some shadowbeing indistinct some kind of humanoid shape
690,the real man was rare and most males were not and are not real men
691,the word in beginning was used only for demigods and superhumans like achilles or diomedes or odysseus
692,in the iliad diomedes in his moment of glory is compared to lion whose spirit has been aroused by anger at wound and scatters the shepherds and dogs before him
693,athena kindled a fire on his head and shoulders and marked him as one possessed by the true inner force inside all things
694,this burst out of him now and made itself light up above all others
695,the real man was a man filled by courage and daring that all came from an excess of being
696,this idea was shared also by other aryan cultures the roman vir the sanskrit and avestan nar the welsh ner the protoindoeuropean hner all ultimately refer to a kind of vital life force capable of superhuman strength
697,there is other word related having to do with manly youth ayu ayu refers to the youthful lifeforce that renews itself in each generation that moves from life to life without end forever persisting
698,it is behind all the indoeuropean words for youth and youthful strength and power
699,it appears in latin iuuenis in sanskrit and all the germanic and english forms
700,but most of all it is this same word this same idea that is behind the latin aetas and aeternus behind the vision of an age a cyclical age of eternity
701,how pregnant in meaning that youth and eternity are the same word and idea in these languages
702,the gothic and germanic words are the same
703,this idea very vivid in greek
704,in this the words aiei meaning forever and the word aion both contain at their root this meaning of lifespan lifeforce youthful strength
705,these peoples saw the vigor of youth as the true driving force behind life and behind all things forever renewing itself reincarnating itself anew in each generation in full force though the memories of men and of societies may disappear
706,if you want the most beautiful poetic expression of this view you must see in the iliad when homer describes the death of euphorbus
707,his death is compared to young tree in its prime blown down by strong wind
708,pythagoras looking on euphorbus’ shield in sicily broke into tears remembering that he had been this man
709,he knew of what was hidden on the other side of the shield
710,this view persists and this is why someone like dh lawrence could look on the sarcophagi of the ancient tuscans and see in this pleasureand beautyloving people a celebration of something very similar
711,they put on their funerary objects images of reveling and feasting and abundant flourishing life and great joy wine parties leaping dolphins to remind themselves that this irrepressible force nature youth continues anew in each generation and is never defeated by death
712,in same way when i poast physiques of beautiful and handsome youths i do so because in contemplating them i am filled with a deep calm and joyi see in them the persistent rejuvenation of this same eternal force that is inside all things
713,i see in this force the hidden design and intention of nature its reaching beyond itself
714,its designs are unspeakable and what it reaches and wants is mysterious to us can only be understood imperfectly and through metaphor
715,its “plan” and design is beyond human comprehension but it is without doubt that it is striving against numerous other “factions” and centrifugal forces for the production and creation of a superior creature of some kind a specimen of terrible beauty and power
716,i have no doubt that the gods if they exist would look only like perfected and improved versions of beautiful physiques of young men just like they showed themselves to the greek oracles in dreams
717,they were the first to discover the true biological and physical form of the man the correct form the true proportions
718,i have no doubt also that this force in being inside us together with others has made human history life and our own minds the battleground and stage of its action and that passivity in the face of its power is therefore absurd it calls on us to allow ourselves to be possessed by it and to wage war on its behalf against its enemies
719,if you want to understand the true power of aion of the eternal youthful energy that is the universe you must study what remains from heraclitus when he uses this word and how he connects it to the idea of fire that is the essence of all things and all action
720,and he is very right when he says “the best desire one thing above all everflowing eternal fame among mortals but the many glut themselves like cattle” this is what i believe in
721,part two parable of iron prison 31 if you recognize pathology brokenness denatured life as what it is it can teach you a lot about life in healthy state
722,there is nothing wrong with looking in life under distress if you no confuse it for life in ascent and freedom
723,when you put some kind of working dog like terrier even cute jack russell in city apartment they will start to try to dig through the floor
724,this mode is inborn to them they seek the development of their powers and there are very few sadder things than to see animal thwarted like this
725,playing at becoming itself but reduced to a doll and useless acting
726,carl schmitt said “they’ve put us out to pasture” this is the condition of life in modern world
727,32 modern world not bad just because modern and it is better than some ages in the past
728,many parts of past were as bad or worse than our situation and for the same reasons
729,the modern is “nothing new” it is the return of a very ancient subjection and brokenness under new branding promoted by new concepts and justifications
730,if you want to see our future look to europe as it existed before 1600 bc or much of the world as it was until recently and still isthe communal life of the longhouse with its young men dominated and broken by the old and sclerotic by the matriarchs the blob and yeast mode in human life overtaking and subjecting all higher aspiration
731,aztec “cities” with twenty morons sleeping and eating off the floor demagogued in the masses by blood hungry priests with dead eyes
732,it is no different if they use the doxies of reason and logos to cart us off to this life
733,33 a history of modern brokenness so many different things have been written about the evils of modernity or the crisis of our situation
734,both on left and right many maybe most feel something has gone terribly wrong
735,even those who love some aspects of the new age like technology look away from our banal time and instead hope for a futuristic flourishing that is not yet here
736,i’m a little tired of all this
737,i don’t want to just repeat more aspersions of modernity which many of you already know
738,most of these are footnotes or commentaries to nietzsche’s prologue from zarathustra where he describes the last man
739,the last man has been wrongly confused for the bourgeois though nietzsche says it’s something much worse
740,houellebecq whose explanations of the sexual problem of modernity of the incel all of these explanations are amazing and true but even he is just following nietzsche
741,if you want to understand true problem of our time you can read that then and i won’t dwell on it
742,i want only to deal with one particular case of domestication brokenness of potentially high life that has been thwarted to illustrate modern problem
743,the peculiar “history” of how the queen develops the modern effeminate homosexual is very telling
744,the problem of the modern homosexual is revealing because it is the model according to which many other kinds of higher life have been thwarted and warped into something else
745,don’t be fooled by propagandists the modern homo has nothing to do with ancient “predatory bisexuality” or with the pederastic rites found in many societies
746,on one hand such people as the modern queen have always existed but on the other there are many specimens now who become this who would not have before
747,it is very unfortunate event in life of animal
748,camille paglia says that the modern homosexual is the product of the pressures of postindustrial life
749,her model for this is that a very sensitive young boy open to aesthetic experience of all kinds maybe the kind of slightly neurotic and artistic boy that a century ago would have experienced synaesthesia such boy is turned off by the horseplay and “rough” masculinity of his brothers and father and other boys his age
