,0
1797,not long after this the peoples of sicily conspired with the house of aragon ruled by relatives of conradin and broke the power of charles in a revolt
1798,this was the end of idea of “universal monarchy” through the papacyand this was the beginning of the national consciousness in europe
1799,the memory of conradin was prized as the promise of beauty and youth memorialized in epics and poetry that rejuvenated the peoples of europe and awoke them
1800,though he died without achieving his goal he died as a martyr for europe against asia and inspired the birth of the new statethe springboard of world conquest that was soon to come in the age of exploration and colonization
1801,christianity is a versatile faith capable of many interpretations
1802,i believe conradin was the most christian prince but also might as well have been the renewed avatar of apollo in europe recalling very old memories
1803,it was the spirit of fire and youth renewing the peoples through its magnetic power and then through the sacrifice of its blood
1804,in moments of torpor we can always return to this spirit of the ancient greeks as a tonic
1805,61 crusaders like cortes and pizarro fernando de soto drake and raleigh magellan and balboa equal in daring intelligence magnitude of spirit resourcefulness and achievement any of the great men of the greeks and romans
1806,the story of the heroic age of exploration remains to be told in full and maybe one of you one day will make big book or big movies
1807,i say also now for those who seek to make a difference and have some artistic or visual bent movies are the golden key to the minds of the many
1808,what mel gibson does is worth a thousand books or “activisms” for your side
1809,learn to make movies if you can and you can start with video
1810,in any case there is just one great epic that tells the story in its proper form the great poem of camoes a man born to piracy and high adventure
1811,this man lost an eye in war in ceuta against the moor he then lived as a brigand and vagabond in imperial lisbon getting into one duel and fight after another composing poetry getting drunk
1812,his mother saved him from prison but he was pressed into service in the colonial navy and army
1813,he arrived in goa and from there participated in many adventures military and diplomatic as a man of low rank but high spirits
1814,all the while he was writing his great poem the lusiad and when he was shipwrecked off the mekong with his chinese girlfriend he carried the text of this timeless work above his head to save it from the water
1815,no one reads it anymore and his life would make a great movie
1816,but he is right that the voyages of these new crusaders equal any great expedition even from the myths and legends of the past
1817,here we have jason’s argo made anew and not just once but in every one of these nations of the west
1818,england’s glory during these years might never be equaled again by any people
1819,even the kings of portugal who started the age of colonization and exploration had english blood
1820,the gothic restlessness of the steppe shook in the lords of iberia with a titanic energy
1821,before the great voyage to the orient of vasco da gama spiesand i mean just one or two menwent alone on expeditions in egypt and down the red sea into the heart of arabia fearlessly incognito to collect information crucial for the coming expedition
1822,perched on the beaches of the great eurasian mass these men went in just a hundred years from sailing a few almostrafts that they barely knew how to navigate to explorers of new worlds and founders of global empires that lasted for centuries
1823,you must understand how amazing this feat was there was no tradition of seamanship in portugal or spain let alone france or englandit all had to be done from scratch
1824,do you know at all to respect the sea
1825,if you’ve ever traveled a ferry on even a relatively calm sea like the adriatic on a windy day a large modern ferry as big as a city blockit will swing right and left
1826,you won’t be used to it
1827,the atlantic has waves ten feet or more as a matter of course and these men were traveling on wooden ships with 15 th century tech you must be crazy to have no awe of this
1828,for romance of the sea you should read melville
1829,columbus is celebrated yes but there were others who were even greater than him or at least his equal and few know about them
1830,they don’t receive the glory they deserve because first many of the writers who could have done this were prejudiced against their strong religious faith and their piety you see most of the modern glorifiers of antiquity usually had an axe to grind against christianity or the church so they didn’t want to promote these men or admit that the champions of the faith were the most shining exemplars of the classical man in our time
1831,even nietzsche stays away from them and in a moment of weakness speaks nonsense about the “superiority” of the aztecs
1832,on the other hand the church has been embarrassed about these men
1833,more than anyone else they spread its power and gospel through the world and even before that they saved europe itself from the moors and the other threats
1834,they’re the direct descendants of the crusaders who liberated spain and other parts of europe
1835,the church doesn’t want to admit that once ferdinand and isabella cleared spain of the enemies of christ god blessed that nation with a century of prosperity and preeminence and gave it the foundation of worldempire
1836,but the church was embarrassed by them by the conquistadores by their cruelty and their pagan love of vitality and action so it tried to disavow them while making use of their strength
1837,so their story remains largely untold although it’s one of the peaks of history and of manly achievement
1838,few understand the voyages for example of even one of the most famous among them vasco da gama and how in many ways it exceeded the feats of columbus
1839,this man circumnavigated africa and found the sea route to the indieswhat columbus had actually set out to do or so the story goesi believe columbus had some secret maps such voyage was attempted long before by the phoenician hanno but no one knows what really came of that
1840,the travel was difficult
1841,when you reach a certain point of the west african coast you can’t just continue to hug along ityou have to pull out to the west and swoop aroundthis is likely how south america was discovered
1842,do you know what starvation scurvy and tropical disease is
1843,do you understand tropical heat
1844,sure some of you might but know that off the west africa coast when a wind blows in your face it’s not a relief it’s like a hairdryer going off in your face nonstop
1845,and yet he reached india he found spices he found monkey he made the zamorin submit with big guns
1846,his investors made thousands of percent return
1847,just seven years later another conquistador returned almeida with a great armada that tore a swathe of destruction along the indian ocean
1848,he burned down mombasa though outnumbered because of the arrogance of its arab rulersimagine the stench that must have wafted as far as japan
1849,this man defeated a huge armada of ottomans arabs mamelukes at the battle of diu to avenge the death of his son and this was momentous time
1850,space itself on our world changed
1851,the great overland routes of trade were now outflanked by the seafaring nations of western europe which from this moment began to dominate the indian ocean and the pacific
1852,do you understand america had a great destiny in this design as well
1853,when the colonists founded jamestown let’s say there were no more than two hundred or two hundred and fifty years from that act to the time of commodore perry the american people had tamed the continent and pushed their way to asia across the seas in no time at all
1854,it would have happened even faster if they hadn’t been hampered by the domination of englandonce they gained their independence their expansion was very fast the constitution the ideology the doctrine of rights is all so much nonsense and has nothing to do with any of thisit barely all even lasted through the lifetimes of the founders of america who were seeking merely dominion and freedom of space to expand
1855,the great destiny of america had always been the conquest of the far east and the domination of china which obsessed the leading minds of that time
1856,all of this has now been forgotten and america’s great fate has been thwartedat least for now
1857,what do you know then of men like this or of afonso de albuquerque who followed almeida who captured hormuz and muscat with seven ships who opened the way to the spice islands of legend
1858,i prefer as usual not to talk of such men they are so far from your possibilities that the example is almost depressing
1859,i want to encourage you again with someone else from this age a man more to my taste and more within the realm of what is possible of what is about to become possible again
1860,this is the brilliant righthandman of cortes pedro de alvarado
1861,he was a man of knightly family from southern spain but had fiery redblond hair which amazed the mexicas they believed he was a child of the sun and called him tonatiuh the mane of the sun
1862,he was of boundless courage carelessness and also boundless cruelty
1863,cortes left him in charge briefly in tenochtitlan where he massacred all the aztec nobles in the great temple during a banquetfor no reason at all
1864,during the battles he distinguished himself by insane charges into the thick of the enemy by which he was outnumbered by hundreds to one yet he never lost heart he went right for their garish flowerdecorated lieutenants and cut them down striking fear into the multitude
1865,don’t believe the lies about gunpowder
1866,guns were very basic at this time and on many occasions the spanish didn’t have guns at all
1867,the armor the pikes the toledo steel blades the discipline and knowhow from decades of fighting the moorall of this was far more important
1868,and above all bravery and daring the same that led pizarro to take down an empire with a retinue of thirteen men
1869,what i want to say about alvarado though is this once conquests were made he never stopped
1870,his thirst for space for new worlds for new conquests was without end
1871,in his letters you see this is his only interest
1872,though made governor of a huge areathe presentday states of guatemala of honduras these are his creationshe nevertheless showed no interest at all in ruling them
1873,he squeezed them of whatever money he could never paying any taxes back to spain and always planned new adventures and new conquests
1874,this man was a born pirate right before his death he was planning a great expedition for the conquest of china and the spice islands
1875,alvarado was a nemesis to civilization and this is right and good
1876,god sends such men to chastise mankind
1877,i want you to be like this to listen to these instincts in you
1878,when he was put in charge of territory alvarado could have very easily settled down to the life of a governor most men would
1879,enticed by the prestige and honor they would play the part then also their vanity would fool them into thinking that they could govern well
1880,well maybe you can govern well or maybe you can’t
1881,but alvarado knew what he was
1882,and he didn’t try to be more than one thing
1883,be one thing
1884,singleminded purity of purpose is true manliness
1885,he knew he was a born beast of prey and never pretended to be more or less than this
1886,this selfassured sense of who he was made him insanely attractive even to the natives he oppressed and massacred despite his cruelty they couldn’t help being drawn to his charm his lofty manner his outrageous magnificence
1887,they worshiped him as a god
1888,the other spaniards were in awe as well
1889,you must see that nature blesses all men who have faith in their own blood and in their instinctsnature blesses them with such magnetism
1890,alvarado is the avatar of our new age and i predict this within fifty years a hundred alvarados will bloom from deep in the tropical bestiary of the spirit
1891,they will sweep away the weakness of this world
1892,62 bob denard shows that the spirit of bronze age pirate can exist also in our age
1893,it can flower complete and unedited
1894,you have no excuse
1895,this man may not be what you expect
1896,how different he is from the pretentious bureaucrats we see the politicians with their highflown language their tedious moral preaching their careful selfpositioning timidity and the drudgery to which they subject themselves
1897,men who embrace highflown moral principle in public are usually looked down on by many regular people they can smell the bullshit from far away
1898,he started out as a regular soldier with the french in vietnam but he was courtmartialed after he burned down a barpart of a dispute you see
1899,some men chimp out by writing a complaint others by getting in a bar fight others by burning down the building
1900,after this he wandered around africa finding odd jobs in the employ of local nabobs and potentates all of them utterly corrupt and incompetent
1901,he said once something like “it’s important never to be ‘ambitious’ men of ‘ambition’ are losers
1902,act and feel like a winner and good things friends and victory will come” he took part in adventures all over africa coups in benin the congo secessionist movements like in biafra the french styling on english nigeria and so forth
1903,his greatest feat was to overthrow the government of the comoros four times
1904,each time france had to send special forces to the islands to dislodge him
1905,otherwise he would have surely become a hereditary ruler
1906,he had many wives and won many properties by the power of his hand
1907,at the end of his lifewellthis life lasted too long
1908,he should have died in defense of his territory younger and without descending into the dementia and pain that took him in old age
1909,france repaid his service with persecution no longer needed to fight communists in africa his vainglory and ferocity became a liability
1910,now if you need great moral elevation if war must be in the service of a good cause you can consider his service in congo in katanga and then against the simba rebels
1911,at stanleyville he along with only a handful of other white mercenaries freed thousands of hostages from rape and sure massacre at the hands of the savage simbas
1912,in many ways he defended whatever residues of civilization remained in africa after decolonization
1913,in this last venture he was joined by a man of similar temperament the colonel “mad mike” hoare
1914,this is another great example of the modern rebirth of bronze age vitalism
1915,and another example of why you’re a fag
1916,an irishenglish dandy he was a gentleman among soldiers but a man before being a gentleman he remained throughout his life singleminded brutal and coolheaded in the middle of conflicts where he was outnumbered thousands to one swamped by the demented zombi hordes of the tropics
1917,this man understood communism for what it was the infestation of vermin he was tasked to exterminate a biological event not an ideological political or historical one
1918,after the war in burma he made a living working on safaris and then like denard gaining experience in the service of various african governments
1919,he led an elite unit of mercs in the congo and in the same operation with denard was responsible for relieving stanleyville and saving a hundred nuns and missionaries from rape and torture
1920,thereafter he led many missions in africa a new frontier
1921,he was later involved in an aborted coup on the seychelles
1922,failure is not dishonorable as long as you are making a great gamble for great gains
1923,it isn’t right to judge such people by the “justice” of their cause
1924,some of you spergs and almost all of the half educated class think when nietzsche talks about “beyond good and evil” that he’s making some grand proposition about there being no possibility to evaluate men or events
1925,morality is absolute necessity for the people
1926,there is the other morality that reveals a biological hierarchy
1927,just the same a different standard applies to huemans and a different one to the true men who are willing to live in danger and who don’t care for their animal lives
1928,men like denard and hoare are a great attempt on the part of nature itself they show that even in our age there are men who yearn inscribe their wills in bronze for the ages who want their terrible creations to endure for centuries
1929,they should be judged by what they were willing to risk in their spiritand also by the unequaled rush they all must have had inside them as they pursued their high aims
1930,even just a few years ago margaret thatcher’s son mark was given a sentence in south africa in 2005 for an attempted coup in equatorial guinea
1931,he was ratted out and caught at the airport
1932,you must understand that the meddlesome little cretinoids who run the west always put a stop to great plans and great actions
1933,they’ve ended many promising adventures through their snoopingthey’re tattletales always watching never sleeping always whispering
1934,gallant men who live under the sign of the lion are stopped before they can act
1935,a different way is necessary
1936,but i mean to say don’t be fooled in our age too men of adamantine character exist who fight like capaneus before thebes ready nude with fire in arm to burn down city
1937,they appear now as villain now as hero to the people but you must learn to forget just this desire of the people and yearn rather to live dangerously and do great deeds for good or evil
1938,the danger of our time is not that it makes people bad but that it makes everything small and afraid
1939,neall ellis in his trusty mi24 hind helicopter held off the rebels in the sierra leone civil war singlehandedly and saved innumerable lives
1940,there’s little glamor in his job and in the end it didn’t matter but on his trusty flying hind steed he must have felt like a beast of prey swooping down on the enemy
1941,he worked for company executive outcomesa name that might make you think of second rate consulting company in office park
1942,but this was merc company that ended the civil war in sierra leone and threatened to establish a new order all over africa
1943,for this reason they were stopped by the un by gangs of international lawyers and financiers who fear the power of the new sea peoples
1944,how long can they hold off such men from their destiny
1945,in the rhodesian war you had companies of a few white farmers raised in the bush who ambushed armies of zambia and mozambique many thousands strong
1946,they would attack with stealth stalking them inflict frightful casualties and escape unharmed
1947,many such stories look up nyadzonya raid
1948,the potential for adventures and conquests like european man has rarely experienced in the past still exists and i have no doubt that in the coming years such opportunities will become ever more frequent
1949,the great leviathan will falter sooner or later
1950,the coming age of barbarism will not be owned as so many of you urban cucks fear by the gangbangers and the unwashed hordes of the teeming cesspools of the world but by cleancut middleclass and workingclass vets men of military experience who know something about how to shoot and how to organize
1951,the fools who think oligarchs will be able to control these men for very long should look to the fortunes of the sforzas and many others and remember that money is no match for force of arms combined with charm
1952,when theodore roosevelt was i think close to seventy years old he went on expedition to the amazon then mostly still unexplored he called it one last chance to be a boy
1953,this expedition led to his death and it was a good death
1954,he followed in footsteps of men of power like lope de aguirreand never lost the yearning in his heart for eldorado
1955,part four a few arrows 63 giving “freedom” to women an impossibility
1956,with the liberation of women in the 19 th century the west has given itself an infection from which it can’t recover without the most terrible convulsions and the most thorough purgative measures
1957,what the “freedom” of women means in practice is the domination of mankind by the demagogues who can rally the lower orders of the spirit
1958,because there is no world in which “the women” can act as a political unit
1959,liberation of women means freedom and power for financiers lawyers purveyors of comforts in and outside government employers who whore out your wife and daughters
1960,it has been the greatest weakening and selfown a civilization has ever visited on itself
1961,but in the end is this so different from democracy as such
1962,yesbecause the “liberation” of women makes democracy into a terminal diseaseone that doesn’t just end a particular government but the civilization
1963,64 if you wonder how mankind fell from the high times of the renaissance and the age of exploration to our times of mediocrity and repressioni can only tell you this that our age is the norm in history
1964,it takes great efforts and much good luck to be able to surpass the dirty ape and rat inside us all
1965,most of mankind never left the regime of deformity and it’s no surprise that this morass is returning
1966,it’s just a reversion to the norm
1967,that said there does seem to be something especially menacing about developments in our age the ubiquity of this leviathan the inability to escape it
1968,everywhere you might become a hermit you are reminded of it it intrudes everywhere
1969,and so the very success of the great men of four hundred years ago their foundation of a new world the great expansion of human knowledge and knowhowthis ended up setting the stage for our trashworld
1970,they succeeded beyond what they could expect and that success is what allowed the profusion of the lower types of mankind
1971,in nature the vital part of mankind would rule and in the beginnings of many societies it does military brotherhoods of men rule and physical force as well as force of personality charisma draw the rest in an orbit around those who possess these in the highest degree
1972,this is all by a natural and secret pull by instinct
1973,there is a magic to charisma that does this and the military monarchical organization the rule of the warlord comes from desire for this in the nature of all not from reflection and abstraction
1974,unfortunately some things conspire to end this original condition of mankind which is itself no paradise and is full of strife suffering and problems
1975,these things are first of all the very success of these men in securing the conditions of life and comfort for the rest of the community
1976,second the ascent within this peacetime of the priest the shaman the schemer and the matriarch which slowly usurp power away from the brotherhoods of young men and their captains
1977,spinoza explains the corruption of the jewish people in just this way the hebrew “republic” was in fact a military regime of the type i say here a rule of the captains
1978,but the priests took this power away and corrupted the nation to weakness
1979,in same way something happened to the aryans in india and in many other places
1980,this state of things doesn’t need to be so the men of religion and those of power have many interests in common and can rule together
1981,but it often happens that the men of power become decadent and let the state drift into the hands of those who can’t ruleand who start to resent them for this abdication
1982,women become also very aggressive once real and relaxed manhood atrophies
1983,if you imagine that women in the muslim world for example are sweet and femininethey are hungry viragos of iron will
1984,the feminist muslima will be a figure of much importance among them
1985,the men in arabia will turn gay
1986,the vietnamese or chinese grandmother has her knee on the neck of the soninlaw
1987,thus everywhere we see that the very comforts and safety produced by the best men leads to the usurpation of society by those parts of the human spirit that are oriented instead toward a different kind of life that everywhere that mode of the yeast wins outand usually wins out very quickly
1988,and in the west whose special fate has been confused for history or progress of the entire species this development has taken place through the promotion of logos or reason and all the manifestations of this the adulation of empty words of legalism as a guide for social and political life of the cult of science that is very far from real science
1989,all of this has been a cover for the ascent of the blob human of the lower orders of the spirit and is instead delivering not just the west but all of mankind to a condition of domestic brokenness and servility
1990,very concretely you see in feminism the return of prearyan matriarchy
1991,the great “earth mother” originally some kind of halfhueman halfcockroach creature resplendent with horrid eggs like big amazon centipedethis seeks to re absorb you
1992,of all the things that you blame for the decrepit times we live in feminism and the “liberation” of women is both the proximate and the ultimate cause
1993,nothing so ridiculous as the liberation of women has ever been attempted in the history of mankind
